name,price,customer_ratings,category,image
"Wireless Earbuds, 2025 Ear Buds with Big Bass Stereo Sound, Lightweight Bluetooth Earbuds with 48 Hours Playtime, in-Ear Fit Earphones, IPX7, Hands-Free Calls with AI for iPhone, Android, Pad",$18..99,4.7 out of 5 stars,wireless earbuds,https://m.media-amazon.com/images/I/61zn4FzsUWL._AC_SX148_SY213_QL70_.jpg
bmani Wireless Earbuds Bluetooth Headphones 48hrs Play Back Sport Earphones with LED Display Over-Ear Buds with Earhooks Built-in Mic Headset for Workout Sky Blue,$39..99,4.3 out of 5 stars,wireless earbuds,"https://m.media-amazon.com/images/I/71x63r82syL._AC_SR263,263_QL70_.jpg"
bmani Wireless Earbuds Bluetooth Headphones 48hrs Play Back Sport Earphones with LED Display Over-Ear Buds with Earhooks Built-in Mic Headset for Workout Sky Blue,$39..99,4.3 out of 5 stars,wireless earbuds,"https://m.media-amazon.com/images/I/71x63r82syL._AC_SR263,263_QL70_.jpg"
"Wireless Charger for MagSafe, AC Island 5-in-1 Portable Travel Charging Station, 15W Max Fast Foldable Magnetic Stand, Evolved for iPhone 16/15/14/13 Series, Apple Watch, AirPods (with 35W Adapter)",$65..97,4.6 out of 5 stars,wireless earbuds,"https://m.media-amazon.com/images/I/710KYL+3n6L._AC_SR263,263_QL70_.jpg"
"Wireless Earbuds, Bluetooth 5.3 Headphones LED Power Display, 2025 New Wireless Earphones, 4 ENC Noise Cancelling Mic, HiFi Stereo, 48H Playtime Mini Case IP7 Waterproof for Sport Walk",$13..99,4.6 out of 5 stars,wireless earbuds,https://m.media-amazon.com/images/I/71VCfvqacPL._AC_SX148_SY213_QL70_.jpg
"Beats Studio Buds - True Wireless Noise Cancelling Earbuds - Compatible with Apple & Android, Built-in Microphone, IPX4 Rating, Sweat Resistant Earphones, Class 1 Bluetooth Headphones - Black",,4.2 out of 5 stars,wireless earbuds,https://m.media-amazon.com/images/I/51bRSWrEc7S._AC_SX148_SY213_QL70_.jpg
"TOZO A1 Wireless Earbuds Bluetooth 5.3 Light Weight in Ear IPX5 Waterproof Headphones 2 Mic for AI Calls, Immersive Premium Sound Bass Headset with Charging Case, 32 Presets EQ Customization via App",$12..98,4.3 out of 5 stars,wireless earbuds,https://m.media-amazon.com/images/I/71Ilitn6B+L._AC_SX148_SY213_QL70_.jpg
"JBL Tune Buds - True wireless Noise Cancelling earbuds, JBL Pure Bass Sound, Bluetooth 5.3, 4-Mic technology for Crisp, Clear Calls, Up to 48 hours of battery life, Water and dust resistant (Black)",$69..95,4.1 out of 5 stars,wireless earbuds,https://m.media-amazon.com/images/I/51EZig0rEAL._AC_SX148_SY213_QL70_.jpg
"Bose QuietComfort Bluetooth Earbuds, True Wireless Earbuds with Active Noise Cancellation and Mic, Deep Bass, IPX4 Rating, Up to 8.5 Hours of Playtime, Black",,4.0 out of 5 stars,wireless earbuds,https://m.media-amazon.com/images/I/61qIEvCy6+L._AC_SX148_SY213_QL70_.jpg
"Wireless Earbuds, Bluetooth 5.4 Headphones HiFi Stereo, Bluetooth Earbuds with ENC Noise Cancelling Mic, IP7 Waterproof in Ear Earphones, 48H, LED Display Ear buds for Pad Workout Sports, Rose Gold",$23..99,4.6 out of 5 stars,wireless earbuds,https://m.media-amazon.com/images/I/71tuY4g-PWL._AC_SX148_SY213_QL70_.jpg
"Wireless Earbuds, Bluetooth 5.4 Ear Buds with Multifunctional Touch Screen, ANC/ENC Noise Cancelling Headphones with 48H Playtime, Bass Stereo Sound, for Laptop, Android/iOS, Pad",$24..29,4.7 out of 5 stars,wireless earbuds,"https://m.media-amazon.com/images/I/61CjlGiCQxL._AC_SR263,263_QL70_.jpg"
"Wireless Earbuds, Bluetooth 5.4 Ear Buds with Multifunctional Touch Screen, ANC/ENC Noise Cancelling Headphones with 48H Playtime, Bass Stereo Sound, for Laptop, Android/iOS, Pad",$24..29,4.7 out of 5 stars,wireless earbuds,"https://m.media-amazon.com/images/I/61CjlGiCQxL._AC_SR263,263_QL70_.jpg"
"Wireless Earbuds, Bluetooth 5.4 Headphones HiFi Stereo, Bluetooth Earbuds with ENC Noise Cancelling Mic, IP7 Waterproof in Ear Earphones, 48H, LED Display Ear buds for Pad Workout Sports, Rose Gold",$23..99,4.6 out of 5 stars,wireless earbuds,"https://m.media-amazon.com/images/I/71tuY4g-PWL._AC_SR263,263_QL70_.jpg"
"Wireless Earbuds, Bluetooth Headphones 5.4 HiFi Stereo, in Ear Earphones with 4 ENC Noise Cancelling Mics, 40H Playtime Ear Buds with Mini Case, IP7 Waterproof Headset with LED Display, USB C Charging",$19..99,4.8 out of 5 stars,wireless earbuds,https://m.media-amazon.com/images/I/61ucuopUmhL._AC_SX148_SY213_QL70_.jpg
"Wireless Earbuds 75hrs Bluetooth 5.4 Headphone Sport, 2025 Bluetooth Earbuds Stereo Deep Bass Over Ear Bud with Earhooks, ENC Noise Cancelling Mic, IPX7 Waterproof Earphone for Workout/Running",$22..79,4.4 out of 5 stars,wireless earbuds,https://m.media-amazon.com/images/I/71NMUHszF4L._AC_SX148_SY213_QL70_.jpg
"Ear Buds Wireless Earbuds - Bluetooth 5.3 Headphones (48H Playback) Built in Mic with LED Display Charging Case, IP7 Waterproof Earphone for iPhone Andriod Phones Laptop Sports Workout",$15..99,4.8 out of 5 stars,wireless earbuds,https://m.media-amazon.com/images/I/61-cWMMLBZL._AC_SX148_SY213_QL70_.jpg
"SAMSUNG Galaxy Buds 3 Pro AI True Wireless Bluetooth Earbuds, Noise Cancelling, Sound Optimization, Redesigned Comfort Fit, Silver [US Version, Amazon Exclusive, 2Yr Warranty]",$199..99,4.2 out of 5 stars,wireless earbuds,https://m.media-amazon.com/images/I/61zW8yc4hTL._AC_SX148_SY213_QL70_.jpg
"Wireless Earbuds, Bluetooth 5.4 Ear Buds with Multifunctional Touch Screen, ANC/ENC Noise Cancelling Headphones with 48H Playtime, Bass Stereo Sound, for Laptop, Android/iOS, Pad",$24..29,4.7 out of 5 stars,wireless earbuds,https://m.media-amazon.com/images/I/61CjlGiCQxL._AC_SX148_SY213_QL70_.jpg
"Wireless Earbuds, Bluetooth Ear Buds Sport, Stereo Deep Bass Over Ear Buds with Earhooks, In Ear Earphones with 4 ENC Noise Cancelling Mic, 48H LED Display Headphone for Running, IP7 Waterproof, White",$21..99,4.6 out of 5 stars,wireless earbuds,https://m.media-amazon.com/images/I/615PeqnG01L._AC_SX148_SY213_QL70_.jpg
Wireless Earbuds Bluetooth 5.4 Headphones with LED Touch Screen 50H Playtime Bass Stereo Ear Buds with Mic IPX5 Waterproof in Ear Earphones for Pad Tablet Laptop Android/iOS Phones (Black),$25..99,4.0 out of 5 stars,wireless earbuds,"https://m.media-amazon.com/images/I/61wpGVziTUL._AC_SR500,500_QL65_.jpg"
"Bose QuietComfort Ultra Bluetooth Earbuds, Wireless Earbuds with Spatial Audio and World-Class Active Noise Cancellation, Deep Bass, Up to 6 Hours of Playtime, Black",,3.8 out of 5 stars,wireless earbuds,https://m.media-amazon.com/images/I/512mPubhJdL._AC_SX148_SY213_QL70_.jpg
"JBL Vibe Beam 2 - True Wireless Noise Cancelling Earbuds Pure Bass Sound & Smart Ambient Technology, 4mics for Crisp, Clear Calls, up to 40Hrs of Playback, IP54 Dust & Water Resistant (Black)",$59..95,4.8 out of 5 stars,wireless earbuds,https://m.media-amazon.com/images/I/618f5yBk26L._AC_SX148_SY213_QL70_.jpg
"Soundcore Sport X20 by Anker, True-Wireless Workout Earbuds, Rotatable and Extendable Ear Hooks, Noise Cancelling, Deep Bass, IP68 Waterproof, Sweatproof, Dustproof, 48H Play, Sport Earbuds for Gym",$79..99,4.3 out of 5 stars,wireless earbuds,https://m.media-amazon.com/images/I/51dhkN5TYiL._AC_SX148_SY213_QL70_.jpg
bmani Wireless Earbuds Bluetooth Headphones 48hrs Play Back Sport Earphones with LED Display Over-Ear Buds with Earhooks Built-in Mic Headset for Workout Black,$39..99,4.3 out of 5 stars,wireless earbuds,https://m.media-amazon.com/images/I/71GPFE2yHGL._AC_SX148_SY213_QL70_.jpg
"kurdene Wireless Earbuds Bluetooth 5.3 in Ear Buds Light Weight Headphones,Deep Bass Sound,Built in Mics Headset,Clear Calls Earphones for Sports Workout",$8..48,4.2 out of 5 stars,wireless earbuds,https://m.media-amazon.com/images/I/715fNrGN+ML._AC_SX148_SY213_QL70_.jpg
"TOZO T6 True Wireless Earbuds Bluetooth 5.3 Headphones 50H Long Playtime, Wireless Charging Case, IPX8 Waterproof Stereo Earphones, Built-in Mic Calls, Headset Premium Deep Bass 32 Preset EQs via APP",$20..98,4.4 out of 5 stars,wireless earbuds,https://m.media-amazon.com/images/I/71cVOgvystL._AC_SX148_SY213_QL70_.jpg
"Raycon Everyday Earbuds (2024 Edition) - Bluetooth True Wireless in-Ear Buds with 32 Hours Playtime, Multpoint Technology, Extreme Comfort, and Active Noise Cancellation (Carbon Black)",$79..99,4.2 out of 5 stars,wireless earbuds,https://m.media-amazon.com/images/I/61Sbw7sQWjL._AC_SX148_SY213_QL70_.jpg
"Wireless Earbuds, Bluetooth 5.4 Headphones HiFi Stereo, Bluetooth Earbuds with ENC Noise Cancelling Mic, IP7 Waterproof in Ear Earphones, 48H, LED Display Ear buds for Pad Workout Sports, Black",$21..99,4.6 out of 5 stars,wireless earbuds,https://m.media-amazon.com/images/I/71U5p3Pxk+L._AC_SX148_SY213_QL70_.jpg
TOZO Hybrid Active Noise Cancelling Wireless Earbuds with 6 Mics AI Clear Call Ear Buds 55H Playtime with LED Display 32 Preset EQs via APP Bluetooth 5.3 IPX8 Waterproof in Ear Headphones,$24..98,4.6 out of 5 stars,wireless earbuds,https://m.media-amazon.com/images/I/71v5thWdStL._AC_SX148_SY213_QL70_.jpg
"Wireless Earbuds 75hrs Bluetooth 5.4 Headphone Sport, 2025 Bluetooth Earbuds Stereo Deep Bass Over Ear Bud with Earhooks, ENC Noise Cancelling Mic, IPX7 Waterproof Earphone for Workout/Running",$22..79,4.4 out of 5 stars,wireless earbuds,"https://m.media-amazon.com/images/I/71NMUHszF4L._AC_SR500,500_QL65_.jpg"
"Compressed Air Duster, 3 Gear to 51000RPM Cordless Electric Air Duster, 6000mAh Rechargeable Air Blower with LED Light for Laptop Computer Camera Keyboard Cleaning Dust Hair Replace Compressed Air Can",$29..98,4.3 out of 5 stars,gaming accessories,https://m.media-amazon.com/images/I/71Wy7p19URL._AC_SX148_SY213_QL70_.jpg
Blue-Light Blocking Glasses Computer Reading/Gaming/TV/Phones Glasses Fashion Anti Eyestrain UV Glasses for Women Men,$13..99,4.4 out of 5 stars,gaming accessories,https://m.media-amazon.com/images/I/617ggopHtYL._AC_SX148_SY213_QL70_.jpg
"Game Room Neon Sign, Gaming Led Lights for Boys Room Decor, Gaming Decor Neon Led Wall Art, USB Powered Light Up Sign, Gamer Gifts for Men, Teen Boys, Kids, Gamer Birthday Party Decorations",$25..99,4.3 out of 5 stars,gaming accessories,https://m.media-amazon.com/images/I/81ulePCu58L._AC_SX148_SY213_QL70_.jpg
Divoom Ditoo Retro Pixel Art Game Bluetooth Speaker with 16X16 LED App Controlled Front Screen (Pink),$69..98,4.6 out of 5 stars,gaming accessories,"https://m.media-amazon.com/images/I/71i3Xb+kNTL._AC_SR263,263_QL70_.jpg"
Divoom Ditoo Retro Pixel Art Game Bluetooth Speaker with 16X16 LED App Controlled Front Screen (Pink),$69..98,4.6 out of 5 stars,gaming accessories,"https://m.media-amazon.com/images/I/71i3Xb+kNTL._AC_SR263,263_QL70_.jpg"
"Luckit Gaming Headphones Stand, RGB Headset Stand with 2 USB Charging Ports, Dual Controller Holder with Light Modes, Earphone Hanger Accessories for Desktop Gamer",$17..09,4.2 out of 5 stars,gaming accessories,"https://m.media-amazon.com/images/I/71+eH-jwtJL._AC_SR263,263_QL70_.jpg"
"LED Light Bar, Music Sync RGB Light Bar, USB Ambient Lamp, Color Changing Gaming TV Backlight with Remote Control, 15 Dynamic Modes for Room Gaming Decoration",$13..59,4.4 out of 5 stars,gaming accessories,https://m.media-amazon.com/images/I/61exnkrjY5L._AC_SX148_SY213_QL70_.jpg
"Foot Rest for Under Desk at Work, Comfortable Foot Stool with 2 Adjustable Heights, Footrest with Washable Cover, for Back & Hip Pain Relief, Suitable for Office, Home and Car (Black)",$18..99,4.5 out of 5 stars,gaming accessories,https://m.media-amazon.com/images/I/61AjtN2tkFL._AC_SX148_SY213_QL70_.jpg
"Frigidaire EFMIS179 Gaming Light Up Mini Beverage Refrigerator, Stealth",$39..00,4.0 out of 5 stars,gaming accessories,https://m.media-amazon.com/images/I/71yl7YJUTKL._AC_SX148_SY213_QL70_.jpg
"Exquisite Gaming: Call of Duty: Monkeybomb - Original Mobile Phone & Gaming Controller Holder, Device Stand, Cable Guys, Licensed Figure",$24..99,4.8 out of 5 stars,gaming accessories,https://m.media-amazon.com/images/I/51LU5w+h2gL._AC_SX148_SY213_QL70_.jpg
"EURPMASK Rotating Headphone Stand - PC Gaming Headset Holder, Adjustable Clamp-on Under Desk Hanger With 360 Degree Swivel & Cable Clip Organizer - Black",$12..99,4.7 out of 5 stars,gaming accessories,https://m.media-amazon.com/images/I/61kpvbJWhLL._AC_SX148_SY213_QL70_.jpg
"LISEN Cell Phone Stand Adjustable for iPhone Phone Holder for Desk, Office Desk Accessories Computer PC for iPhone Stand Gaming Essentials Fit Otterbox Case Phones Switch Kindle iPad Air Tablet 4-10in",$8..79,4.5 out of 5 stars,gaming accessories,https://m.media-amazon.com/images/I/61DjtpKn5gL._AC_SX148_SY213_QL70_.jpg
"Logitech G29 Driving Force Racing Wheel and Floor Pedals, Real Force Feedback, Stainless Steel Paddle Shifters, Leather Steering Wheel Cover for PS5, PS4, PC, Mac - Black",,4.6 out of 5 stars,gaming accessories,https://m.media-amazon.com/images/I/61IwZwlTopL._AC_SX148_SY213_QL70_.jpg
"BENGOO G9000 Stereo Gaming Headset for PS4 PC Xbox One PS5 Controller, Noise Cancelling Over Ear Headphones with Mic, LED Light, 7.1 Surround Sound, Soft Memory Earmuffs for Nintendo Xbox Series X|S",$16..98,4.3 out of 5 stars,gaming accessories,https://m.media-amazon.com/images/I/61CGHv6kmWL._AC_SX148_SY213_QL70_.jpg
Audioengine A2+ Desktop 24 Bit Wireless Bluetooth Desktop Speakers - 60W Computer Speakers for Music and Gaming,$279..00,4.4 out of 5 stars,gaming accessories,https://m.media-amazon.com/images/I/51dqqbw2DhL._AC_SX148_SY213_QL70_.jpg
"MEKASS Ergonomic Mouse Pad and Keyboard Wrist Rest Set, Super Soft Memory Foam Desk Wrist Support for Computer Keyboard, Non-Slip Arm Palm Rests Cushion for Typing Gaming Office Laptop Mac (Black)",$26..99,4.6 out of 5 stars,gaming accessories,https://m.media-amazon.com/images/I/71B2yHn5GHL._AC_SX148_SY213_QL70_.jpg
"RGB Mousepad Led Mouse Pad, Large Mouse Pad,Led and Big Mouse mat",$9..99,4.6 out of 5 stars,gaming accessories,https://m.media-amazon.com/images/I/61nSvG2CHQL._AC_SX148_SY213_QL70_.jpg
"KontrolFreek Precision Rings | Aim Assist Motion Control for Playstation 4 (PS4), PS5, Xbox One, XBX, Switch Pro & Scuf Controller (Black/Purple/Green)",$10..99,4.0 out of 5 stars,gaming accessories,https://m.media-amazon.com/images/I/81vWntXa1tL._AC_SX148_SY213_QL70_.jpg
"Turtle Beach Stealth 700 Gen 3 Wireless Multiplatform Amplified Gaming Headset for Xbox Series X|S, Xbox One, PC, PS5, Mobile – 60mm Drivers, AI Noise-Cancelling Mic, Bluetooth, 80-Hr Battery – Cobalt",$175..78,4.3 out of 5 stars,gaming accessories,https://m.media-amazon.com/images/I/710TCfRprkL._AC_SX148_SY213_QL70_.jpg
Divoom Ditoo Retro Pixel Art Game Bluetooth Speaker with 16X16 LED App Controlled Front Screen (Pink),$69..98,4.6 out of 5 stars,gaming accessories,"https://m.media-amazon.com/images/I/71i3Xb+kNTL._AC_SR263,263_QL70_.jpg"
Divoom Ditoo Retro Pixel Art Game Bluetooth Speaker with 16X16 LED App Controlled Front Screen (Pink),$69..98,4.6 out of 5 stars,gaming accessories,"https://m.media-amazon.com/images/I/71i3Xb+kNTL._AC_SR263,263_QL70_.jpg"
"PULIDIKI Car Cleaning Gel Car Clean Putty, Universal Car Interior Cleaner Slime, Perfect Cleaning Kit Supplies, Auto Detailing Tools Accessories, Dust Remover Gifts for Men Women",$7..99,4.1 out of 5 stars,gaming accessories,"https://m.media-amazon.com/images/I/71YLxhnPUxL._AC_SR263,263_QL70_.jpg"
KAFRI RGB Headphone Stand with Wireless Charger Desk Gaming Headset Holder Hanger Rack with 10W/7.5W QI Charging Pad and QC 3.0 USB Port - Suitable for Gamer Desktop Table Game Earphone Accessories,$8..99,4.5 out of 5 stars,gaming accessories,https://m.media-amazon.com/images/I/71PPp9qElML._AC_SX148_SY213_QL70_.jpg
"Corner Floor Lamp - Smart RGB LED Corner Lamp with App and Remote Control, 16 Million Colors & 68+ Scene, Music Sync, Timer Setting - Ideal for Living Rooms, Bedrooms, and Gaming Rooms",$49..99,4.4 out of 5 stars,gaming accessories,https://m.media-amazon.com/images/I/61ff09oRxJL._AC_SX148_SY213_QL70_.jpg
"4 in 1 Metal Clip On Cup Holder Attachment for Gaming Desk or Table, Sturdy and Easy to Clamp, Attachable Anti-Spill Cup Holder for Salon Chair, Bedside, Water Bottles, Drinks, Headphones - Black",$26..99,4.3 out of 5 stars,gaming accessories,https://m.media-amazon.com/images/I/71kR6BNHBZL._AC_SX148_SY213_QL70_.jpg
"Govee Glide Hexa Light Panels, RGBIC Hexagon LED Wall Lights, Wi-Fi Smart Home Creative Wall Lights with Music Sync, Works with Alexa Google Assistant for Indoor Gaming Decor, 10 Pack",$189..99,4.4 out of 5 stars,gaming accessories,https://m.media-amazon.com/images/I/61WCvyYZPcL._AC_SX148_SY213_QL70_.jpg
"Upgraded Large Desk Cup Holder Clamp, OOKUU Anti-Spill Table Cup Holder, Metal Office & PC Gaming Desk Accessories, Compatible with Universal Cup, Bottles, Pencil Holder (Black)",,4.6 out of 5 stars,gaming accessories,https://m.media-amazon.com/images/I/61JPPHfGaVL._AC_SX148_SY213_QL70_.jpg
"MATICOD LED Lights for TV Led Backlight, 9.84 RGB Led Strip Lights USB TV Lights Behind 32-43 TV, APP Remote Control Music Sync TV LED Lights",$6..99,4.5 out of 5 stars,gaming accessories,https://m.media-amazon.com/images/I/71T14VfXezL._AC_SX148_SY213_QL70_.jpg
"Elgato Stream Deck Mini – Control Zoom, Teams, PowerPoint, MS Office and More, Boost Productivity with Seamless Integration for Daily Apps, Set Up Shortcuts Easily, Compatible with Mac and PC",$57..99,4.8 out of 5 stars,gaming accessories,https://m.media-amazon.com/images/I/61Dz1qvtZcL._AC_SX148_SY213_QL70_.jpg
"Paladone Playstation Controller Icons Light with 3 Light Modes - Sound Reactive, Dynamic Phasing, and Standard Mode - Gaming Desk Accessories and Game Room Decor",$21..99,4.7 out of 5 stars,gaming accessories,https://m.media-amazon.com/images/I/61VwnuGUMTS._AC_SX148_SY213_QL70_.jpg
"VELENTI Gamer Chair Phone Stand - Phone Holder for Smartphones, Kindles Up to 19 cm Tall - Fun Gaming Accessories for Gamers - Useful Gamer Gadgets - Lovely Birthday Gift for Gamers",$12..99,4.1 out of 5 stars,gaming accessories,https://m.media-amazon.com/images/I/618orotkOxL._AC_SX148_SY213_QL70_.jpg
"USB 3.0 Hub, VIENON 4-Port USB Hub USB Splitter USB Expander for Laptop, Xbox, Flash Drive, HDD, Console, Printer, Camera,Keyborad, Mouse(Not for Charging)",$6..88,4.4 out of 5 stars,gaming accessories,https://m.media-amazon.com/images/I/61cg1AdFLoL._AC_SX148_SY213_QL70_.jpg
"C CUSHION LAB Patented Pressure Relief Seat Cushion for Long Sitting Hours on Office/Home Chair, Car, Wheelchair - Extra-Dense Memory Foam for Hip, Tailbone, Coccyx, Sciatica - Light Grey",$74..99,4.3 out of 5 stars,gaming accessories,https://m.media-amazon.com/images/I/51jlg6xxfOL._AC_SX148_SY213_QL70_.jpg
"Gaming Blanket Toys Gifts for Boys - Glow in The Dark Game Controller Throw for Kids Age 1-14 Year Old Teens Child Toddler Son Birthday Christmas Valentines Easter Presents Gamer Room Decor 50""x60""",$23..99,4.7 out of 5 stars,gaming accessories,https://m.media-amazon.com/images/I/81n2l9RHVqL._AC_SX148_SY213_QL70_.jpg
"JBL Quantum 910 - Wireless Over-Ear Performance Gaming Headset with Head Tracking-Enhanced, Active Noise Cancelling and Bluetooth, QuantumSPATIAL 360, Low Latency Wireless System (Black)",$299..95,4.2 out of 5 stars,gaming accessories,https://m.media-amazon.com/images/I/61tsQpAxchL._AC_SX148_SY213_QL70_.jpg
"Keyboard Cleaning Kit Laptop Cleaner, 10-in-1 Computer Screen Cleaning Brush Tool, Multi-Function PC Electronic Cleaner Kit Spray for iPad iPhone Pro, Earbuds, Camera Monitor, All-in-one with Patent",$13..69,4.6 out of 5 stars,gaming accessories,https://m.media-amazon.com/images/I/71AJth10-BL._AC_SX148_SY213_QL70_.jpg
"20Ft Neon Rope Lights,Flexible Led Rope Lights Control with App/Remote,Multiple Modes Rope Lights,IP65 Outdoor RGB Led Neon Lights Waterproof,Music Sync Gaming Led Neons Light Strip for Bedroom Decor",$8..49,4.3 out of 5 stars,gaming accessories,https://m.media-amazon.com/images/I/71xprNiGJJL._AC_SX148_SY213_QL70_.jpg
"Elgato Stream Deck MK.2 – Studio Controller, 15 macro keys, trigger actions in apps and software like OBS, Twitch, ​YouTube and more, works with Mac and PC",$149..99,4.8 out of 5 stars,gaming accessories,https://m.media-amazon.com/images/I/81xN-mI5KBL._AC_SX148_SY213_QL70_.jpg
"Turtle Beach Stealth 700 Gen 3 Wireless Multiplatform Amplified Gaming Headset for Xbox Series X|S, Xbox One, PC, PS5, Mobile – 60mm Drivers, AI Noise-Cancelling Mic, Bluetooth, 80-Hr Battery – Cobalt",$175..78,4.3 out of 5 stars,gaming accessories,https://m.media-amazon.com/images/I/710TCfRprkL._AC_SX148_SY213_QL70_.jpg
"GIM Wireless Charging RGB Gaming Mouse Pad 15W, LED Mouse Mat 800x300x4MM, 10 Light Modes Extra Large Mousepad Non-Slip Rubber Base Computer Keyboard Mat for Gaming, MacBook, PC, Laptop, Desk",$36..99,4.5 out of 5 stars,gaming accessories,https://m.media-amazon.com/images/I/51-L9tPVbHL._AC_SX148_SY213_QL70_.jpg
"Govee Smart LED Light Bars, Work with Alexa and Google Assistant, RGBICWW WiFi TV Backlights with Scene and Music Modes for Gaming, Pictures, PC, Room Decoration",$39..99,4.6 out of 5 stars,gaming accessories,https://m.media-amazon.com/images/I/71BjVOxoWuL._AC_SX148_SY213_QL70_.jpg
Divoom Ditoo Retro Pixel Art Game Bluetooth Speaker with 16X16 LED App Controlled Front Screen (Pink),$69..98,4.6 out of 5 stars,gaming accessories,https://m.media-amazon.com/images/I/71i3Xb+kNTL._AC_SX148_SY213_QL70_.jpg
"C CUSHION LAB Ergonomic Foot Rest for Under Desk - Patented Massage Ridge Design Memory Foam Foot Stool Pillow for Work, Home, Gaming, Computer, Office Chair - Footrest for Back & Hip Pain Relief",$55..00,4.5 out of 5 stars,gaming accessories,https://m.media-amazon.com/images/I/51uLsBpXYEL._AC_SX148_SY213_QL70_.jpg
"CRUA 32"" 4K Gaming Monitor, IPS UHD(3840 * 2160P) 144Hz Monitors, Computer Monitor Support FreeSync, HDR, 120% sRGB, 1.07B Color Depth, with HDMI 2.1/DP 1.4 and Built-in Speaker, Support Wall- Black",$399..99,2.6 out of 5 stars,4K monitors,https://m.media-amazon.com/images/I/71YlS-6rX5L._AC_SX148_SY213_QL70_.jpg
"INNOCN 27G1V 27 Inch Monitor 4K 144Hz HDR400 PC Computer Gaming Monitor G-Sync Compatible, 1MS, USB Type-C, HDMI, DisPlayPort, Height Adjustable Stand, VESA Mountable, Machine Black",$274..99,3.9 out of 5 stars,4K monitors,https://m.media-amazon.com/images/I/71gzgtl4wdL._AC_SX148_SY213_QL70_.jpg
"ASUS TUF Gaming 27” 4K HDR Monitor (VG27UQ1A) – 160Hz, 1ms, Extreme Low Motion Blur Sync, NVIDIA G-SYNC Compatible, AMD FreeSync Premium, 95% DCI-P3, DisplayWidget, 3 yr Warranty",$349..99,3.0 out of 5 stars,4K monitors,https://m.media-amazon.com/images/I/61KcZ+6kvXL._AC_SX148_SY213_QL70_.jpg
"Philips 27E1N1800A 27"" IPS 4K UHD (3840 x 2160) Monitor, Built-in Speakers, HDR 10, AMD FreeSync, LowBlue Mode, Flicker-Free, VESA, 4Yr Advance Replacement Warranty",$174..99,4.0 out of 5 stars,4K monitors,https://m.media-amazon.com/images/I/61U01fJM+0L._AC_SX148_SY213_QL70_.jpg
"27 Inch 4K UHD(3840 * 2160) Computer Monitor - IPS Monitor, 60hz, HDR400, Anti-Blue Light Screen, DCI-P3 95% 125% sRGB, Support FreeSync and GSync, PC Monitor for Design, Work,Casual Gaming",$189..99,4.4 out of 5 stars,4K monitors,https://m.media-amazon.com/images/I/71b+UNcbNzL._AC_SX148_SY213_QL70_.jpg
"SAMSUNG 27-Inch ViewFinity S7 (S70D) Series 4K UHD High Resolution Monitor with HDR10, Multiple Ports, Easy Setup Stand, Advanced Eye Care, LS27D702EANXGO, 2024",$349..99,4.2 out of 5 stars,4K monitors,"https://m.media-amazon.com/images/I/61CeL9O2BYL._AC_SR263,263_QL70_.jpg"
"SAMSUNG 27-Inch ViewFinity S7 (S70D) Series 4K UHD High Resolution Monitor with HDR10, Multiple Ports, Easy Setup Stand, Advanced Eye Care, LS27D702EANXGO, 2024",$349..99,4.2 out of 5 stars,4K monitors,"https://m.media-amazon.com/images/I/61CeL9O2BYL._AC_SR263,263_QL70_.jpg"
"ZZA 34 Inch Monitor Curved Ultrawide,34 Inch Gaming Curved Monitor R1500 165hz Refresh Rate165Hz(DP)/144HZ (HDMI) WQHD 3440x1440,Computer Monitors 1ms, FreeSync & G-Sync,HDR10,122% sRGB,VESA",$199..99,4.2 out of 5 stars,4K monitors,"https://m.media-amazon.com/images/I/719-YH2gSML._AC_SR263,263_QL70_.jpg"
"27 Inch White Gaming Monitor 300Hz/320Hz, QHD 1440P Fast IPS Computer Monitor with Adaptive FreeSync, HDR400, Height/Pivot/Swivel/Tilt Adjustable, DP&HDMI, H27E6",$299..99,4.5 out of 5 stars,4K monitors,"https://m.media-amazon.com/images/I/71Y0b4LUlRL._AC_SR500,500_QL65_.jpg"
"SAMSUNG 27-Inch ViewFinity S7 (S70D) Series 4K UHD High Resolution Monitor with HDR10, Multiple Ports, Easy Setup Stand, Advanced Eye Care, LS27D702EANXGO, 2024",$349..99,4.2 out of 5 stars,4K monitors,https://m.media-amazon.com/images/I/61CeL9O2BYL._AC_SX148_SY213_QL70_.jpg
"27 Inch 4K Monitor, UHD (3840 * 2160) IPS Ultra-Slim Bezel Monitor for Photo Video Editing, ΔE < 2, 100% DCI-P3, 1.07B+ Colors, Height/Pivot/Tilt/Swivel, Built-in Dual Speaker, DP/HDMI",$206..99,4.0 out of 5 stars,4K monitors,https://m.media-amazon.com/images/I/71ZLsqP3DHL._AC_SX148_SY213_QL70_.jpg
"Dell S3221QS 32 Inch Curved 4K UHD (3840 x 2160), VA Ultra-Thin Bezel Monitor, 60Hz, 4MS Response Time, 90% DCI-P3, 99% sRGB, AMD FreeSync, HDMI, DisplayPort, Built in Speakers, VESA Certified, Silver",$359..69,4.4 out of 5 stars,4K monitors,https://m.media-amazon.com/images/I/71LP6483haL._AC_SX148_SY213_QL70_.jpg
LG 32UR500K-B Ultrafine 32-inch 4K UHD (3840x2160) Computer Monitor HDR10 Built-in Speaker x2 OnScreen Control Reader Mode Flicker Safe Borderless Design HDMIx2 DisplayPort Black,$298..21,4.5 out of 5 stars,4K monitors,https://m.media-amazon.com/images/I/619Rkt7GTwL._AC_SX148_SY213_QL70_.jpg
"SAMSUNG 27-inch Odyssey 3D G90XF, 4K, 165Hz, Gaming Monitor, 1ms Response Time, AMD FreeSync™ Premium, Ergonomic Stand, LS27FG900XNXZA, 2025","$1,999..99",3.6 out of 5 stars,4K monitors,https://m.media-amazon.com/images/I/81T7dxB6AfL._AC_SX148_SY213_QL70_.jpg
"KOORUI 27 Inch 4K Monitor Computer UHD(3840 * 2160) IPS Display, 99% sRGB, 90% DCI-P3, 1.07 Billion Colors, Displayport & 2X HDMI, VESA 100 * 100mm, Tilt (N07)",$199..99,4.3 out of 5 stars,4K monitors,https://m.media-amazon.com/images/I/81pXhUjZW7L._AC_SX148_SY213_QL70_.jpg
