name,price,customer_ratings,category,image
"eufy Smart Lock C33, Keyless Fingerprint Door Lock with Handle, Integrated Wi-Fi, Remote Control via App, Biometric Entry Knob, Auto-Locking, IP53 Waterproof (2025 New Version)",$129..99,4.6 out of 5 stars,smart home devices,https://m.media-amazon.com/images/I/51U3gWXoAcL._AC_SX148_SY213_QL70_.jpg
"Amazon Echo Show 10 (newest model), HD smart display with premium sound, motion and Alexa, Charcoal",,4.5 out of 5 stars,smart home devices,https://m.media-amazon.com/images/I/51mZTrzrBqL._AC_SX148_SY213_QL70_.jpg
"Kasa Smart Plug HS103P4, Smart Home Wi-Fi Outlet Works with Alexa, Echo, Google Home & IFTTT, No Hub Required, Remote Control, 15 Amp, UL Certified, 4-Pack, White",$24..99,4.6 out of 5 stars,smart home devices,https://m.media-amazon.com/images/I/51zoLDBO0wL._AC_SX148_SY213_QL70_.jpg
"Skylight Calendar: 15-inch Wall Planner Digital Calendar & Chore Chart, Smart Touchscreen Interactive Display for Family Schedules – Wall Mount Included, Great for Organizing Your 2025 Calendar",$319..99,4.5 out of 5 stars,smart home devices,https://m.media-amazon.com/images/I/71Kxk8es6dL._AC_SX148_SY213_QL70_.jpg
"TCL Security Smart Lock D1, Fingerprint Door Lock Deadbolt, Built-in 2.4 WiFi Deadbolt for Front Door Works with Alexa & Google Assistant, Easy Installation",$89..99,5.0 out of 5 stars,smart home devices,https://m.media-amazon.com/images/I/61VLaGDonfL._AC_SX148_SY213_QL70_.jpg
"Frizzlife LP365 Smart Water Monitor and Automatic Shutoff - 0.01GPM Ultrasonic Micro Leak Detection, APP Wi-Fi Remote Control, Real-Time Flow/Temp Monitoring, 24/7 Water Usage Reports, 3/4"" and 1""",$299..99,4.8 out of 5 stars,smart home devices,"https://m.media-amazon.com/images/I/71M+nNjFTLL._AC_SR263,263_QL70_.jpg"
"Frizzlife LP365 Smart Water Monitor and Automatic Shutoff - 0.01GPM Ultrasonic Micro Leak Detection, APP Wi-Fi Remote Control, Real-Time Flow/Temp Monitoring, 24/7 Water Usage Reports, 3/4"" and 1""",$299..99,4.8 out of 5 stars,smart home devices,"https://m.media-amazon.com/images/I/71M+nNjFTLL._AC_SR263,263_QL70_.jpg"
Smart Towel Warmer - Coolbreeze Insulation Tech | Voice Control with Alexa & Google Assistant | Matte Finish | 20L,$89..99,4.1 out of 5 stars,smart home devices,"https://m.media-amazon.com/images/I/61ijBnhVSeL._AC_SR263,263_QL70_.jpg"
"Ring Battery Doorbell, Head-to-Toe Video, Live View with Two-Way Talk, and Motion Detection & Alerts (2024 release), Venetian Bronze",,4.6 out of 5 stars,smart home devices,https://m.media-amazon.com/images/I/41FtCUr5PuL._AC_SX148_SY213_QL70_.jpg
"Amazon Echo Dot (newest model), Vibrant sounding Alexa speaker, Great for bedrooms, dining rooms and offices, Glacier White",,4.6 out of 5 stars,smart home devices,https://m.media-amazon.com/images/I/71168bJdfnL._AC_SX148_SY213_QL70_.jpg
"Kasa Smart Light Bulbs, Full Color Changing Dimmable Smart WiFi Bulbs Compatible with Alexa and Google Home, A19, 9W 800 Lumens,2.4Ghz only, No Hub Required, 4 Count (Pack of 1), Multicolor (KL125P4)",$24..64,4.5 out of 5 stars,smart home devices,https://m.media-amazon.com/images/I/61Y-TtwpVIL._AC_SX148_SY213_QL70_.jpg
"Outlet Extender with Night Light, HANYCONY Multi Plug Outlet, USB Wall Charger Surge Protector 4 USB Ports(1 USB C), Power Strip Electrical Outlet Splitter Expander for Home Office Dorm Room, ETL",$12..99,4.6 out of 5 stars,smart home devices,https://m.media-amazon.com/images/I/51IN2UzjteL._AC_SX148_SY213_QL70_.jpg
"Keyless-Entry Door Lock, Fingerprint Smart Locks for Front Door, Deadbolt Smart Lock, Auto Lock-App Remote Control-Easy Install, Electronic Door Lock Perfect for Exterior, Interior, Bedroom",$56..79,3.9 out of 5 stars,smart home devices,https://m.media-amazon.com/images/I/61htYhpJ-DL._AC_SX148_SY213_QL70_.jpg
"Fingerprint Door Lock, Smart Fingerprint Door Knob with Lock, Biometric Door Lock with App Control & Key, Keyless Thumbprint Entry Door Lock for Bedroom, Front Door, Home, Apartment-Silver",$49..99,4.5 out of 5 stars,smart home devices,https://m.media-amazon.com/images/I/71j03P7EosL._AC_SX148_SY213_QL70_.jpg
"EIGHTREE Smart Plug, Smart Home WiFi Outlet Works with Alexa & Google Home, Smart Socket with Remote Control & Timer Function, 2.4GHz WiFi Only, 4 Packs",$19..99,4.5 out of 5 stars,smart home devices,https://m.media-amazon.com/images/I/61N63ZDrGML._AC_SX148_SY213_QL70_.jpg
"Ring Battery Doorbell, Head-to-Toe Video, Live View with Two-Way Talk, and Motion Detection & Alerts (2024 release), Venetian Bronze",,4.6 out of 5 stars,smart home devices,https://m.media-amazon.com/images/I/41FtCUr5PuL._AC_SX148_SY213_QL70_.jpg
"ULTRALOQ 2025 Upgrade Bolt Fingerprint Smart Lock,Biometric Deadbolt with Built in WiFi,Keyless Entry Door Lock for Front Door,App Remote Control,10 Months Battery,IP65 Waterproof,BHMA Grade AAA",$199..99,4.4 out of 5 stars,smart home devices,https://m.media-amazon.com/images/I/81ip7mqEm5L._AC_SX148_SY213_QL70_.jpg
"Sound Bar for Smart TV, Soundbar with Bluetooth/ARC/Opt/AUX Connect, Auto Volume Boost, 3 Equalizer Modes, 2 in 1 Detachable Soundbar for TV/PC/Gaming/Projectors",$49..99,4.4 out of 5 stars,smart home devices,https://m.media-amazon.com/images/I/61LH-GmVZlL._AC_SX148_SY213_QL70_.jpg
"EZVALO Under Cabinet Lights, LED Closet Lights Wireless USB Charging, Motion Sensor Lighting Indoor 5700K Dimmable with Remote Control (White) 5 Pack",$39..99,4.2 out of 5 stars,smart home devices,https://m.media-amazon.com/images/I/61iNDe4zQyL._AC_SX148_SY213_QL70_.jpg
"CHAMBERLAIN Smart Garage Control - Wireless Garage Hub and Sensor with Wifi & Bluetooth - Smartphone Controlled, myQ-G0401-ES, White",$27..79,4.3 out of 5 stars,smart home devices,https://m.media-amazon.com/images/I/51U402oH80L._AC_SX148_SY213_QL70_.jpg
"Kasa Smart Plug Power Strip HS300, Surge Protector with 6 Individually Controlled Smart Outlets and 3 USB Ports, Works with Alexa & Google Home, No Hub Required , White",$43..99,4.6 out of 5 stars,smart home devices,https://m.media-amazon.com/images/I/61PI8akrKOL._AC_SX148_SY213_QL70_.jpg
"Linkind Smart Light Bulbs, Smart Bulb That Work with Alexa & Google Home, LED Light Bulbs Color Changing, 104 Preset Scene, Music Sync, A19 E26 2.4GHz RGBTW WiFi Bluetooth Light Bulb 60W, 800LM, 4Pack",$25..49,4.6 out of 5 stars,smart home devices,https://m.media-amazon.com/images/I/610pDnVRosL._AC_SX148_SY213_QL70_.jpg
"WAVLINK 2025 AX3000 WiFi 6 Wireless Outdoor Repeater, Long Range Outdoor WiFi Extender with Dual Band/PoE/IP67 /600mW of Power/Up to 256 Devices, Work with Starlink Support for Farm,Campsite",$183..99,4.3 out of 5 stars,smart home devices,"https://m.media-amazon.com/images/I/61+xb-NeYQL._AC_SR263,263_QL70_.jpg"
"WAVLINK 2025 AX3000 WiFi 6 Wireless Outdoor Repeater, Long Range Outdoor WiFi Extender with Dual Band/PoE/IP67 /600mW of Power/Up to 256 Devices, Work with Starlink Support for Farm,Campsite",$183..99,4.3 out of 5 stars,smart home devices,"https://m.media-amazon.com/images/I/61+xb-NeYQL._AC_SR263,263_QL70_.jpg"
"5MP Wireless Video Doorbell Camera, No Monthly Fee, 5GHz WiFi, 180° Head-to-Toe View, AI Motion Detection, VR Mode, Battery or Wired Powered, Easy Installation, Weatherproof",$99..97,4.5 out of 5 stars,smart home devices,"https://m.media-amazon.com/images/I/71MvAWDYBBL._AC_SR263,263_QL70_.jpg"
"Runstar Smart Scale for Body Weight and Fat Percentage, High Accuracy Digital Bathroom Scale with Large Display for BMI Heart Rate 15 Body Composition Analyzer Sync with Fitness App 400lb",$39..99,4.6 out of 5 stars,smart home devices,https://m.media-amazon.com/images/I/61NTLzrO27L._AC_SX148_SY213_QL70_.jpg
"Kasa Smart Indoor Pan-Tilt Home Security Camera, 1080p HD Dog Camera w/Night Vision, Motion Detection for Baby & Pet Monitor, Cloud & SD Card Storage, Works w/ Alexa & Google Home, 2.4G WiFi (EC71)",$19..99,4.4 out of 5 stars,smart home devices,https://m.media-amazon.com/images/I/61GrnhJtS7L._AC_SX148_SY213_QL70_.jpg
"Fingerprint Door Lock, Smart Fingerprint Door Knob with Lock, Biometric Door Lock with App Control & Key, Keyless Thumbprint Entry Door Lock for Bedroom, Front Door, Home, Apartment-Silver",$49..99,4.5 out of 5 stars,smart home devices,https://m.media-amazon.com/images/I/71j03P7EosL._AC_SX148_SY213_QL70_.jpg
"Kasa Smart Indoor Pan-Tilt Home Security Camera, 1080p HD Dog Camera w/Night Vision, Motion Detection for Baby & Pet Monitor, Cloud & SD Card Storage, Works w/ Alexa & Google Home, 2.4G WiFi (EC71)",$19..99,4.4 out of 5 stars,smart home devices,https://m.media-amazon.com/images/I/61GrnhJtS7L._AC_SX148_SY213_QL70_.jpg
"Kasa Smart Light Switch HS200P3, Single Pole, Needs Neutral Wire, 2.4GHz Wi-Fi Light Switch Works with Alexa and Google Home, UL Certified, No Hub Required, 3 Count -Pack of 1 , White",$33..99,4.6 out of 5 stars,smart home devices,https://m.media-amazon.com/images/I/61Du7b9kpxL._AC_SX148_SY213_QL70_.jpg
"Wall Outlet Extender with Shelf and Night Light,Surge Protector,USB Wall Charger with 5 AC Outlets and 3 USB Ports 1 USB C Outlet Wide Space 3-Sided Power Strip Multi Plug Outlets…",$11..99,4.5 out of 5 stars,smart home devices,https://m.media-amazon.com/images/I/511RHXivY1L._AC_SX148_SY213_QL70_.jpg
"WAVLINK 2025 AX3000 WiFi 6 Wireless Outdoor Repeater, Long Range Outdoor WiFi Extender with Dual Band/PoE/IP67 /600mW of Power/Up to 256 Devices, Work with Starlink Support for Farm,Campsite",$183..99,4.3 out of 5 stars,smart home devices,"https://m.media-amazon.com/images/I/61+xb-NeYQL._AC_SR263,263_QL70_.jpg"
"WAVLINK 2025 AX3000 WiFi 6 Wireless Outdoor Repeater, Long Range Outdoor WiFi Extender with Dual Band/PoE/IP67 /600mW of Power/Up to 256 Devices, Work with Starlink Support for Farm,Campsite",$183..99,4.3 out of 5 stars,smart home devices,"https://m.media-amazon.com/images/I/61+xb-NeYQL._AC_SR263,263_QL70_.jpg"
Smart Towel Warmer - Coolbreeze Insulation Tech | Voice Control with Alexa & Google Assistant | Matte Finish | 20L,$89..99,4.1 out of 5 stars,smart home devices,"https://m.media-amazon.com/images/I/61ijBnhVSeL._AC_SR263,263_QL70_.jpg"
"EIGHTREE Smart Plug, Smart Plugs That Work with Alexa and Google Home, Compatible with SmartThings, Smart Outlet with WiFi Remote Control and Timer Function, 2.4GHz Wi-Fi Only, 4 Packs",$21..05,4.4 out of 5 stars,smart home devices,https://m.media-amazon.com/images/I/61N5B-hXXXL._AC_SX148_SY213_QL70_.jpg
"Kasa Smart LED Light Strip, 16.4ft WiFi LED Strip Works with Alexa, Google Home, SmartThings, High Brightness with 16 Million Colors, RGB, Grouping, Adjustable Length, Up to 25,000 Hours (KL400L5)",$19..98,4.4 out of 5 stars,smart home devices,https://m.media-amazon.com/images/I/61ul+J5L+FL._AC_SX148_SY213_QL70_.jpg
"Uigos LED Night Light Lamp with Smart Sensor Dusk to Dawn Sensor, Daylight White, 0.5W Plug-in, 6-Pack",$7..99,4.7 out of 5 stars,smart home devices,https://m.media-amazon.com/images/I/61jJspQTTlL._AC_SX148_SY213_QL70_.jpg
"Google TV Streamer 4K - Fast Streaming Entertainment on Your TV with Voice Search Remote - Watch Movies, Shows, Live TV, and Netflix in 4K HDR - Smart Home Control - 32 GB of Storage - Porcelain",$99..99,4.3 out of 5 stars,smart home devices,https://m.media-amazon.com/images/I/510wm50VDHL._AC_SX148_SY213_QL70_.jpg
"Keyless-Entry Door Lock, Fingerprint Smart Locks for Front Door, Deadbolt Smart Lock, Auto Lock-App Remote Control-Easy Install, Electronic Door Lock Perfect for Exterior, Interior, Bedroom",$56..79,3.9 out of 5 stars,smart home devices,https://m.media-amazon.com/images/I/61htYhpJ-DL._AC_SX148_SY213_QL70_.jpg
Smart Towel Warmer - Coolbreeze Insulation Tech | Voice Control with Alexa & Google Assistant | Matte Finish | 20L,$89..99,4.1 out of 5 stars,smart home devices,https://m.media-amazon.com/images/I/61ijBnhVSeL._AC_SX148_SY213_QL70_.jpg
"Govee RGBIC Floor Lamp, LED Corner Lamp Works with Alexa, 1000 Lumen Smart Modern Floor Lamp with Music Sync and 16 Million DIY Colors, Color Changing Standing Lamp for Bedroom Living Room Black",$66..49,4.5 out of 5 stars,smart home devices,https://m.media-amazon.com/images/I/615Yog6t9nL._AC_SX148_SY213_QL70_.jpg
"WYZE Cam Pan v3 Indoor/Outdoor IP65 1080P 360° Pan/Tilt/Zoom Wi-Fi Smart Home Security Camera with Motion Tracking for Baby & Pet, Color Night Vision, Works with Alexa & Google Assistant, White",$36..99,4.3 out of 5 stars,smart home devices,https://m.media-amazon.com/images/I/51DkvoYXSyL._AC_SX148_SY213_QL70_.jpg
"ecobee Smart Thermostat Premium with Smart Sensor and Air Quality Monitor - Programmable Wifi Thermostat - Works with Siri, Alexa, Google Assistant",$233..99,4.4 out of 5 stars,smart home devices,https://m.media-amazon.com/images/I/51U1jXuTPVL._AC_SX148_SY213_QL70_.jpg
"GHome Smart Plug,WiFi Smart Plugs Compatible with Alexa and Google Home,Smart WiFi Outlet with Remote Control and Timer Function,2.4GHz Wi-Fi Only,No Hub Required, ETL FCC Listed,White(4 Pack)",$26..99,4.3 out of 5 stars,smart home devices,https://m.media-amazon.com/images/I/61mwZi5guiL._AC_SX148_SY213_QL70_.jpg
"Blink Video Doorbell (newest model) — Two-way audio, HD video, long-lasting battery life, wired or wire-free install, motion detection, chime app alerts, Works with Alexa (Black)",,4.2 out of 5 stars,smart home devices,https://m.media-amazon.com/images/I/41te-uzWxDL._AC_SX148_SY213_QL70_.jpg
"Smart Watch with Alexa Built-in‌, 1.83'' Touchscreen with Call Function, IP68 Waterproof Fitness Tracker, 100+ Sport Modes, Heart Rate & Sleep Monitor, Pedometer, iOS/Android Compatible (Black)",$24..99,4.1 out of 5 stars,smart home devices,https://m.media-amazon.com/images/I/71paaKY3zJL._AC_SX148_SY213_QL70_.jpg
"Govee Smart Light Bulbs, Color Changing Light Bulb, Work with Alexa and Google Assistant, 16 Million Colors RGBWW, WiFi & Bluetooth LED Light Bulbs, Music Sync, A19, 800 Lumens, 4 Pack",$39..99,4.6 out of 5 stars,smart home devices,https://m.media-amazon.com/images/I/61G5-oBZmzL._AC_SX148_SY213_QL70_.jpg
"32GB FRAMEO 10.1 Inch Smart WiFi Digital Photo Frame 1280x800 IPS LCD Touch Screen, Auto-Rotate Portrait and Landscape, Built in 32GB Memory, Share Moments Instantly via Frameo App from Anywhere",$69..99,4.5 out of 5 stars,smart home devices,https://m.media-amazon.com/images/I/71v8cZ36vwL._AC_SX148_SY213_QL70_.jpg
"ULTRALOQ 2025 Upgrade Bolt Fingerprint Smart Lock,Biometric Deadbolt with Built in WiFi,Keyless Entry Door Lock for Front Door,App Remote Control,10 Months Battery,IP65 Waterproof,BHMA Grade AAA",$199..99,4.4 out of 5 stars,smart home devices,https://m.media-amazon.com/images/I/81ip7mqEm5L._AC_SX148_SY213_QL70_.jpg
"WAVLINK 2025 AX3000 WiFi 6 Wireless Outdoor Repeater, Long Range Outdoor WiFi Extender with Dual Band/PoE/IP67 /600mW of Power/Up to 256 Devices, Work with Starlink Support for Farm,Campsite",$183..99,4.3 out of 5 stars,smart home devices,"https://m.media-amazon.com/images/I/61+xb-NeYQL._AC_SR263,263_QL70_.jpg"
"WAVLINK 2025 AX3000 WiFi 6 Wireless Outdoor Repeater, Long Range Outdoor WiFi Extender with Dual Band/PoE/IP67 /600mW of Power/Up to 256 Devices, Work with Starlink Support for Farm,Campsite",$183..99,4.3 out of 5 stars,smart home devices,"https://m.media-amazon.com/images/I/61+xb-NeYQL._AC_SR263,263_QL70_.jpg"
"Keypad Smart Door Knob Lock, Fingerprint Keyless Entry Door Lock with Handle for Front Door and Bedroom, Electrionic Biometric Code Door Knob with APP, Auto Lock for Home Office Apartment Garage",$49..29,4.3 out of 5 stars,smart home devices,"https://m.media-amazon.com/images/I/61T-TyZhC+L._AC_SR263,263_QL70_.jpg"
"ASUS TUF Gaming A15 Gaming Laptop, 15.6” FHD 144Hz Display, NVIDIA® GeForce RTX™ 2050, AMD Ryzen™ 5 7535HS, 8GB DDR5, 512GB PCIe® Gen4 NVMe™ SSD, Wi-Fi 6, Windows 11, FA506NF-ES51",$599..99,4.3 out of 5 stars,laptops,https://m.media-amazon.com/images/I/81kxce-AlLL._AC_SX148_SY213_QL70_.jpg
"Naclud Windows 11 Laptops, 17.3 Inch Laptop Computer with Core i3 Processor, 4GB DDR3 128GB SSD, 60800mWh Battery, FHD IPS Display, Type-C, HDMI, 5G WiFi, BT4.2, Webcam, USB3.2",$769..99,5.0 out of 5 stars,laptops,https://m.media-amazon.com/images/I/71nTyCvso5L._AC_SX148_SY213_QL70_.jpg
"Acer Aspire 3 A315-24P-R7VH Slim Laptop | 15.6"" Full HD IPS Display | AMD Ryzen 3 7320U Quad-Core Processor | AMD Radeon Graphics | 8GB LPDDR5 | 128GB NVMe SSD | Wi-Fi 6 | Windows 11 Home in S Mode",$299..99,4.2 out of 5 stars,laptops,https://m.media-amazon.com/images/I/61gKkYQn6lL._AC_SX148_SY213_QL70_.jpg
"2025 Laptop, Laptop Computer with Intel Quad-Core Processor(Up to 3.6GHz), 16GB DDR4 512GB SSD Windows 11 Laptop, 16.0"" IPS 1080P, USB3.2, Long Battery Life",$359..99,5.0 out of 5 stars,laptops,https://m.media-amazon.com/images/I/61j3uzJvVLL._AC_SX148_SY213_QL70_.jpg
"ASUS TUF Gaming A15 Gaming Laptop, 15.6” FHD 144Hz Display, NVIDIA® GeForce RTX™ 2050, AMD Ryzen™ 5 7535HS, 8GB DDR5, 512GB PCIe® Gen4 NVMe™ SSD, Wi-Fi 6, Windows 11, FA506NF-ES51",$599..99,4.3 out of 5 stars,laptops,"https://m.media-amazon.com/images/I/81kxce-AlLL._AC_SR263,263_QL70_.jpg"
"ASUS TUF Gaming A15 Gaming Laptop, 15.6” FHD 144Hz Display, NVIDIA® GeForce RTX™ 2050, AMD Ryzen™ 5 7535HS, 8GB DDR5, 512GB PCIe® Gen4 NVMe™ SSD, Wi-Fi 6, Windows 11, FA506NF-ES51",$599..99,4.3 out of 5 stars,laptops,"https://m.media-amazon.com/images/I/81kxce-AlLL._AC_SR263,263_QL70_.jpg"
"HP Elitebook 650 G10 15 15.6"" FHD Business Laptop Computer, 13th Gen Intel 10-Core i7-1355U, 64GB DDR4 RAM, 2TB PCIe SSD, WiFi 6E, BT5.3, Backlit Keyboard, Fingerprint Reader, Windows 11 Pro, AZ-XUT","$1,119..00",4.4 out of 5 stars,laptops,"https://m.media-amazon.com/images/I/71zD5A4WG6L._AC_SR263,263_QL70_.jpg"
"18.5""Laptop Computer with Windows 11 PRO,8000 mAh Battery,Intel N150 Quad-Core Processor UP to 3.6GHZ,16GB DDR4 RAM 512GB SSD,WiFi 5,Full HD IPS Display,2025 Laptops for Work Business Office Student","$1,399..99",4.0 out of 5 stars,laptops,https://m.media-amazon.com/images/I/718P0vmKBbL._AC_SX148_SY213_QL70_.jpg
"15.6 Inch Laptop with Office 365, 4GB RAM, 128GB Storage Expandable 1TB, 5205U Processor, HD Display, Windows 11 Laptops Computer, Wi-Fi 5, BT4.2, Numpad, Type-C, for Business and Students.",$199..99,4.1 out of 5 stars,laptops,https://m.media-amazon.com/images/I/71vwx59yoVL._AC_SX148_SY213_QL70_.jpg
"HP 14 Laptop, Intel Celeron N4020, 4 GB RAM, 64 GB Storage, 14-inch Micro-edge HD Display, Windows 11 Home, Thin & Portable, 4K Graphics, One Year of Microsoft 365 (14-dq0040nr, Snowflake White)",,4.1 out of 5 stars,laptops,https://m.media-amazon.com/images/I/815uX7wkOZS._AC_SX148_SY213_QL70_.jpg
"2025 AMD Laptop, 16.0inch Laptop Computer with AMD Ryzen 7 5000 Series(8C/16T, Up to 4.3GHz), 16GB RAM 512GB NVMe SSD Windows 11 Laptop, Radeon RX Vega 8 Graphics,WiFi 6, Backlit KB,53Wh Battery,Gray",$474..99,4.9 out of 5 stars,laptops,https://m.media-amazon.com/images/I/71oW0a2K8+L._AC_SX148_SY213_QL70_.jpg
"ASUS Chromebook CX1, 15.6"" FHD NanoEdge Display, Intel Celeron N4500 Processor, 64GB eMMC Storage, 8GB RAM, ChromeOS, Transparent Silver, CX1500CKA-AS84F",$189..99,4.4 out of 5 stars,laptops,https://m.media-amazon.com/images/I/71-4taykpML._AC_SX148_SY213_QL70_.jpg
"ASUS ROG Strix G16 Gaming Laptop, 165Hz Display, NVIDIA® GeForce RTX™ 4060, Intel Core i7-13650HX, 16GB DDR5, 1TB PCIe Gen4 SSD, Wi-Fi 6E, Windows 11, G614JV-AS74","$1,244..78",4.4 out of 5 stars,laptops,https://m.media-amazon.com/images/I/81GrCeuCzxL._AC_SX148_SY213_QL70_.jpg
"HP Pavilion 15.6"" HD Touchscreen Anti-Glare Laptop, 16GB RAM, 1TB SSD Storage, Intel Core Processor up to 4.1GHz, Up to 11 Hours Long Battery Life, Type-C, HDMI, Windows 11 Home, Silver",$429..99,4.2 out of 5 stars,laptops,https://m.media-amazon.com/images/I/71aTEZOda0L._AC_SX148_SY213_QL70_.jpg
"Lenovo IdeaPad Slim 3i - 2024 - Lightweight Laptop - Rapid Charge Boost - 14"" FHD IPS Display - 16GB Memory - 512GB SSD Storage - Intel® Core™ i7-13620H - Windows 11 HomeArctic Grey",$635..74,4.1 out of 5 stars,laptops,https://m.media-amazon.com/images/I/71iy6ZIxabL._AC_SX148_SY213_QL70_.jpg
"Dell Latitude 3550 Business Laptop Computer 15.6"" FHD, Intel 12-Core Ultra 7 155U (Beat i7-1355U), 64GB DDR5 RAM, 2TB PCIe SSD, WiFi 6, BT 5.3, Backlit Keyboard, Fingerprint Reader, Windows 11 Pro","$1,229..00",4.3 out of 5 stars,laptops,https://m.media-amazon.com/images/I/81d6mClnJeL._AC_SX148_SY213_QL70_.jpg
"HP 14"" Ultral Light Laptop for Students and Business, Intel Quad-Core, 8GB RAM, 192GB Storage(64GB eMMC+128GB Ghost Manta SD Card), 1 Year Office 365, USB C, Win 11 S",$224..10,4.0 out of 5 stars,laptops,https://m.media-amazon.com/images/I/81divYKpeTL._AC_SX148_SY213_QL70_.jpg
"ASUS 14"" FHD Laptop, Intel Pentium N6000 Processor, 4GB RAM, 224GB Storage(64GB eMMC+160GB Docking Station Set), Intel UHD Graphics, Webcam, Bluetooth, Win 11, Star Black",$218..99,4.4 out of 5 stars,laptops,https://m.media-amazon.com/images/I/81kEod68yLL._AC_SX148_SY213_QL70_.jpg
"Dell Latitude 3550 Laptop Computer for Business and Work, 13th Gen Intel 10-Core i5-1335U (Beat i7-1255U), 16GB DDR5 RAM, 512GB PCIe SSD, 15.6"" FHD, WiFi 6E, Bluetooth 5.3, USB4 Type-C, Windows 11 Pro",$759..00,4.5 out of 5 stars,laptops,https://m.media-amazon.com/images/I/81RuYfizHuL._AC_SX148_SY213_QL70_.jpg
"HP Elitebook 650 G10 15 15.6"" FHD Business Laptop Computer, 13th Gen Intel 10-Core i7-1355U, 32GB DDR4 RAM, 1TB PCIe SSD, WiFi 6E, BT5.3, Backlit Keyboard, Fingerprint Reader, Windows 11 Pro, AZ-XUT",$999..00,4.4 out of 5 stars,laptops,https://m.media-amazon.com/images/I/71zD5A4WG6L._AC_SX148_SY213_QL70_.jpg
"Acer Nitro V Gaming Laptop | Intel Core i5-13420H Processor | NVIDIA GeForce RTX 4050 Laptop GPU | 15.6"" FHD IPS 144Hz Display | 8GB DDR5 | 512GB Gen 4 SSD | WiFi 6 | Backlit KB | ANV15-51-51H9",$758..90,4.3 out of 5 stars,laptops,"https://m.media-amazon.com/images/I/71F-Wcriq4L._AC_SR500,500_QL65_.jpg"
"Lenovo V-Series V15 Business Laptop, 15.6"" FHD Display, AMD Ryzen 7 7730U, 40GB RAM, 1TB SSD, Numeric Keypad, HDMI, RJ45, Webcam, Wi-Fi, Windows 11 Pro, Black",$562..49,4.2 out of 5 stars,laptops,https://m.media-amazon.com/images/I/71TN6dLVcsL._AC_SX148_SY213_QL70_.jpg
"HP Portable Laptop, Student and Business, 14"" HD Display, Intel Quad-Core N4120, 16GB DDR4 RAM, 64GB eMMC, 1 Year Office 365, Webcam, RJ-45, HDMI, Wi-Fi, Windows 11 Home, Silver",$218..96,4.1 out of 5 stars,laptops,https://m.media-amazon.com/images/I/61IpRGnny7L._AC_SX148_SY213_QL70_.jpg
"Lenovo IdeaPad Slim 3i - 2024 - Lightweight Laptop - Rapid Charge Boost - 14"" FHD IPS Display - 16GB Memory - 512GB SSD Storage - Intel® Core™ i7-13620H - Windows 11 HomeArctic Grey",$635..74,4.1 out of 5 stars,laptops,https://m.media-amazon.com/images/I/71iy6ZIxabL._AC_SX148_SY213_QL70_.jpg
"HP Chromebook 14 Laptop, Intel Celeron N4120, 4 GB RAM, 64 GB eMMC, 14"" HD Display, Chrome OS, Thin Design, 4K Graphics, Long Battery Life, Ash Gray Keyboard (14a-na0226nr, 2022, Mineral Silver)",$184..89,4.3 out of 5 stars,laptops,https://m.media-amazon.com/images/I/71tXLOE7wIL._AC_SX148_SY213_QL70_.jpg
"HP Portable Laptop, Student and Business, 14"" HD Display, Intel Quad-Core N4120, 16GB DDR4 RAM, 64GB eMMC, 1 Year Office 365, Webcam, RJ-45, HDMI, Wi-Fi, Windows 11 Home, Silver",$218..96,4.1 out of 5 stars,laptops,https://m.media-amazon.com/images/I/61IpRGnny7L._AC_SX148_SY213_QL70_.jpg
"HP Stream 14"" HD BrightView Laptop, Intel Celeron N4120, 16GB RAM, 288GB Storage (128GB eMMC + 160GB Docking Station Set), Intel UHD Graphics, 720p Webcam, Wi-Fi, 1 Year Office 365, Win 11 S, Silver",$262..65,4.2 out of 5 stars,laptops,https://m.media-amazon.com/images/I/61Uw0-2+2YL._AC_SX148_SY213_QL70_.jpg
"Lenovo IdeaPad 1i Laptop, 15.6"" FHD Touchscreen, Intel Core i5-1235U Processor, 16GB RAM, 512GB SSD, Webcam, HDMI, Wi-Fi 6, Windows 11 Home, Blue",$439..99,4.5 out of 5 stars,laptops,https://m.media-amazon.com/images/I/71PCVp1dbdL._AC_SX148_SY213_QL70_.jpg
ASUS E410 Intel Celeron N4020 4GB 64GB 14-Inch HD LED Win 10 Laptop (Star Black),$159..00,4.0 out of 5 stars,laptops,https://m.media-amazon.com/images/I/614Jk1dIoGL._AC_SX148_SY213_QL70_.jpg
"15.6 Inch Laptops, 8GB DDR3 512GB SSD Windows 11 Laptop Computer with I3 Processor, HD Display, 52Wh Battery, Wi-Fi 5, BT4.2, HDMI, USB3.2, Type-C, for Business and Students",$219..99,4.1 out of 5 stars,laptops,https://m.media-amazon.com/images/I/61VvZKF+wUL._AC_SX148_SY213_QL70_.jpg
"Laptop Computer 15.6"" Full HD IPS Display Laptop with N97 Processor(Up to 3.6GHz)Work Laptops 16GB RAM 512GB SSD Windows 11 Laptop Business Computer Light&Thin, Metal Shell, Webcam, Type-C, USB3.2",$357..99,5.0 out of 5 stars,laptops,https://m.media-amazon.com/images/I/71n4VNZPcXL._AC_SX148_SY213_QL70_.jpg
"Dell Latitude 5550 15 15.6"" FHD Business AI Laptop Computer, Intel Ultra 5 135U (Beat i7-1355U), 64GB DDR5 RAM, 1TB SSD, WiFi 6, Bluetooth 5.3, Backlit Keyboard, Fingerprint Reader, Windows 11 Pro","$1,199..00",4.6 out of 5 stars,laptops,https://m.media-amazon.com/images/I/81AO+92feeL._AC_SX148_SY213_QL70_.jpg
"Dell Latitude 3550 Laptop Computer for Business Work, Intel 10-Core i5-1335U (Beat i7-1255U), 16GB DDR5 RAM, 512GB PCIe SSD, 15.6"" FHD, WiFi 6E, Bluetooth 5.3, FHD Camera, USB4 Type-C, Windows 11 Pro",$769..00,4.6 out of 5 stars,laptops,https://m.media-amazon.com/images/I/81OSVN7tgRL._AC_SX148_SY213_QL70_.jpg
"HP 17 Laptop, 17.3"" FHD Display, 32GB RAM, 1TB SSD, AMD Ryzen 5 Processor(Beats i7-1165G7, Up to 4.3GHz), Webcam, Numeric Keypad, Long Battery Life, Windows 11 Home, Alpacatec Accessories, Silver",$519..00,4.0 out of 5 stars,laptops,https://m.media-amazon.com/images/I/71v+60IGI6L._AC_SX148_SY213_QL70_.jpg
"Dell Inspiron 15.6"" Laptop Computer, Windows 11 Pro Laptop 32GB RAM 1TB SSD, Intel Core i7-1255U Processor, 1920 x 1080 IPS 120Hz Display, Microsoft Office Lifetime License, Numeric Keypad, Black",$660..00,4.1 out of 5 stars,laptops,https://m.media-amazon.com/images/I/613fkzXfcQL._AC_SX148_SY213_QL70_.jpg
